{
  "schema_version": 1,
  "updated_at": "2026-09-06T00:08:11.970Z",
  "currency": "ARS",
  "packs": [
    {
      "mb": 5120,
      "days": 7,
      "price": 6930,
      "comment": "Pack de internet"
    },
    {
      "mb": 3072,
      "days": 3,
      "price": 3420,
      "comment": "Pack de internet"
    },
    {
      "mb": 2048,
      "days": 1,
      "price": 1935,
      "comment": "Pack de internet"
    },
    {
      "mb": 12288,
      "days": 30,
      "price": 11700,
      "comment": "Pack de internet"
    },
    {
      "mb": 10240,
      "days": 15,
      "price": 6000,
      "comment": "WiFi Pass"
    },
    {
      "mb": 10240,
      "days": 3,
      "price": 4500,
      "comment": "WiFi Pass"
    },
    {
      "mb": 3072,
      "days": 1,
      "price": 3000,
      "comment": "WiFi Pass"
    },
    {
      "mb": 30720,
      "days": 30,
      "price": 15000,
      "comment": "WiFi Pass"
    }
  ]
}
