{
  "schema_version": 1,
  "updated_at": "2026-07-14T02:16:42.611Z",
  "currency": "ARS",
  "packs": [
    {
      "mb": 5120,
      "days": 7,
      "price": 7700,
      "comment": "Pack de internet"
    },
    {
      "mb": 3072,
      "days": 7,
      "price": 6350,
      "comment": "Pack de internet"
    },
    {
      "mb": 5120,
      "days": 3,
      "price": 4850,
      "comment": "Pack de internet"
    },
    {
      "mb": 3072,
      "days": 3,
      "price": 3800,
      "comment": "Pack de internet"
    },
    {
      "mb": 2048,
      "days": 1,
      "price": 2150,
      "comment": "Pack de internet"
    },
    {
      "mb": 10240,
      "days": 30,
      "price": 13000,
      "comment": "Pack mensual"
    },
    {
      "mb": 5120,
      "days": 30,
      "price": 10000,
      "comment": "Pack mensual"
    }
  ]
}
